{"artifact_id":"schuss-artifact-000014","artifact_kind":"link-map","byte_length":149761,"byte_sha256":"d27603a4fa85425badbac601f4e3c22fc8618dc4dec1a756df593ccf2bc28da4","canonical_profile":"schuss-canonical-json-v1","content_hash":"sha256:3aa20aa8a6379a71973f355926e729e4fd67fb74376a86c0e45579d7d65b0133","input_closure_hash":"sha256:e8088f4cf6cf479de7144e9c02cc9e85f00ef50298892735fee6a106875d9b04","media_type":"text/plain","parent_artifact_references":[{"artifact_id":"schuss-artifact-000012","content_hash":"sha256:a2c050970da792cb5da2863fc1d8cb2d12e187eb2ebb0a885c741bc7bc6587a1","revision":1}],"portable_locator":"sha256/d27603a4fa85425badbac601f4e3c22fc8618dc4dec1a756df593ccf2bc28da4","producer_contract":{"producer_id":"schuss-task009-backend","producer_version":"task009-v1"},"producer_stage":"target-compile-link","revision":1,"schema_version":"artifact-descriptor-v0","source_map_artifact_references":[{"artifact_id":"schuss-artifact-000010","content_hash":"sha256:816ea84e979d7968c787e75368fecb12fd028158adc3739ba31d16c2d96009b6","revision":1}]}
