{"artifact_id":"schuss-artifact-000002","artifact_kind":"legacy-boundary-patch","byte_length":1461,"byte_sha256":"f9492e2e959e9f49f0f4c26136f4071e39e8cf17a7b0d231e9fb0f7be8c60f6f","canonical_profile":"schuss-canonical-json-v1","content_hash":"sha256:b3180ecded22a039dfa9ab20c011ba5ec758f305a030089252f49c590434e700","input_closure_hash":"sha256:5e6ac25c66fb195874c68beacb37d787647f173cfd142820f2bf8b8f75480b96","media_type":"application/vnd.ksoloti.axp+xml","parent_artifact_references":[{"artifact_id":"schuss-artifact-000001","content_hash":"sha256:b3067931f581e6feedff19e6833a41df40e9b6a905d37f941483f81e5307af93","revision":1}],"portable_locator":"sha256/f9492e2e959e9f49f0f4c26136f4071e39e8cf17a7b0d231e9fb0f7be8c60f6f","producer_contract":{"producer_id":"schuss-task009-backend","producer_version":"task009-v1"},"producer_stage":"artifact-generation","revision":1,"schema_version":"artifact-descriptor-v0","source_map_artifact_references":[]}
