{"artifact_id":"schuss-artifact-000008","artifact_kind":"resolution-plan","byte_length":1289,"byte_sha256":"4a1cf154ee864953658d42db8255be0662e3b0342c1b42791271dc8a8f448da4","canonical_profile":"schuss-canonical-json-v1","content_hash":"sha256:3f6a787c5afc1584caf900b21116ea94398aa4f57265fcb077a251c8058017ae","input_closure_hash":"sha256:e8088f4cf6cf479de7144e9c02cc9e85f00ef50298892735fee6a106875d9b04","media_type":"application/vnd.schuss.resolution-plan+json","parent_artifact_references":[],"portable_locator":"sha256/4a1cf154ee864953658d42db8255be0662e3b0342c1b42791271dc8a8f448da4","producer_contract":{"producer_id":"schuss-task009-backend","producer_version":"task009-v1"},"producer_stage":"implementation-resolution","revision":1,"schema_version":"artifact-descriptor-v0","source_map_artifact_references":[]}
