{"artifact_id":"schuss-artifact-000005","artifact_kind":"arm-object","byte_length":7380,"byte_sha256":"cf8eb67a66dbc4938ea7f695298b92f7c3509dc86c1ad96e538b2abf46583d39","canonical_profile":"schuss-canonical-json-v1","content_hash":"sha256:5d1f6a05e8882ab5f46049b90485aad9735a25a7380b548eb74258c95e6536f0","input_closure_hash":"sha256:5e6ac25c66fb195874c68beacb37d787647f173cfd142820f2bf8b8f75480b96","media_type":"application/x-elf-object","parent_artifact_references":[{"artifact_id":"schuss-artifact-000004","content_hash":"sha256:f47eec10fc7868100d000ca8de16831c3c9b3860329735823d4631cb081f9157","revision":1}],"portable_locator":"sha256/cf8eb67a66dbc4938ea7f695298b92f7c3509dc86c1ad96e538b2abf46583d39","producer_contract":{"producer_id":"schuss-task009-backend","producer_version":"task009-v1"},"producer_stage":"target-compile-link","revision":1,"schema_version":"artifact-descriptor-v0","source_map_artifact_references":[{"artifact_id":"schuss-artifact-000003","content_hash":"sha256:15abd69ecb978a0a1dc662f9db3c10bca540618b73dca7661e4788013bbf2c47","revision":1}]}
