{"artifact_id":"schuss-artifact-000010","artifact_kind":"source-map","byte_length":1406,"byte_sha256":"c1f2d270df37ca016f360d441960c78653e9e39c1589be3f31412d9935d71ee0","canonical_profile":"schuss-canonical-json-v1","content_hash":"sha256:816ea84e979d7968c787e75368fecb12fd028158adc3739ba31d16c2d96009b6","input_closure_hash":"sha256:e8088f4cf6cf479de7144e9c02cc9e85f00ef50298892735fee6a106875d9b04","media_type":"application/vnd.schuss.source-map+json","parent_artifact_references":[{"artifact_id":"schuss-artifact-000008","content_hash":"sha256:3f6a787c5afc1584caf900b21116ea94398aa4f57265fcb077a251c8058017ae","revision":1},{"artifact_id":"schuss-artifact-000009","content_hash":"sha256:d0ea4b6b650fd611bc88de55bae4666202d9dcd60e73308a50fca42a3dccc531","revision":1}],"portable_locator":"sha256/c1f2d270df37ca016f360d441960c78653e9e39c1589be3f31412d9935d71ee0","producer_contract":{"producer_id":"schuss-task009-backend","producer_version":"task009-v1"},"producer_stage":"artifact-generation","revision":1,"schema_version":"artifact-descriptor-v0","source_map_artifact_references":[]}
