{"artifact_id":"schuss-artifact-000024","artifact_kind":"source-map","byte_length":19982,"byte_sha256":"8992679f5d12c5f1d46d1ed0a30220b2ee8dd3511240c7bcaab80d3a95837d7c","canonical_profile":"schuss-canonical-json-v1","content_hash":"sha256:5e3d74f9e252cd9452803c20bede127f4a979dbd3a7b334091e8c3cc6e4514dd","input_closure_hash":"sha256:9cb02fc0b02b9583021dba982cbe014bc163942a4ed950a1e7fcdd06d8ba40a2","media_type":"application/vnd.schuss.source-map+json","parent_artifact_references":[{"artifact_id":"schuss-artifact-000022","content_hash":"sha256:8999719fb6feb5c316b2de05ae6c306293328aadf054f27eed84832271b5dd7f","revision":1},{"artifact_id":"schuss-artifact-000023","content_hash":"sha256:59a24c49cdd5f46f56574051c858c0dcc0a41ec66bfbfb258873727a2f8924a5","revision":1}],"portable_locator":"sha256/8992679f5d12c5f1d46d1ed0a30220b2ee8dd3511240c7bcaab80d3a95837d7c","producer_contract":{"producer_id":"schuss-task011c-backend","producer_version":"task011c-v1"},"producer_stage":"artifact-generation","revision":1,"schema_version":"artifact-descriptor-v0","source_map_artifact_references":[]}
