{"artifact_id":"schuss-artifact-000027","artifact_kind":"target-executable","byte_length":69404,"byte_sha256":"d04cc20d5dc0cfe195ce38ee850857c0b8af8675f7616898f50dd6e77372db2a","canonical_profile":"schuss-canonical-json-v1","content_hash":"sha256:faf3b77644e875b146bdab1699d10bfc49295946ce1aa452fc4827e9f5b5c1b7","input_closure_hash":"sha256:9cb02fc0b02b9583021dba982cbe014bc163942a4ed950a1e7fcdd06d8ba40a2","media_type":"application/x-elf","parent_artifact_references":[{"artifact_id":"schuss-artifact-000026","content_hash":"sha256:129d1d0f60490f29d7f960998094b7b9011f146ef582a465d3cca11fdd8dcda9","revision":1}],"portable_locator":"sha256/d04cc20d5dc0cfe195ce38ee850857c0b8af8675f7616898f50dd6e77372db2a","producer_contract":{"producer_id":"schuss-task011c-backend","producer_version":"task011c-v1"},"producer_stage":"target-compile-link","revision":1,"schema_version":"artifact-descriptor-v0","source_map_artifact_references":[{"artifact_id":"schuss-artifact-000024","content_hash":"sha256:5e3d74f9e252cd9452803c20bede127f4a979dbd3a7b334091e8c3cc6e4514dd","revision":1}]}
